<!ELEMENT library (book+)>

<!ELEMENT book (title, author, year, genre)>

<!ELEMENT title (#PCDATA)>
<!ELEMENT author (#PCDATA)>
<!ELEMENT year (#PCDATA)>
<!ELEMENT genre (#PCDATA)>
